"episode_name","duration_seconds","transcription"
"Go ikatisa morago ga go bona moento wa COVID19","498.98","eketshedimosetso ya kowid  oitlisediwa ke motswedinya fem konka bokamosoeeponso a koruke moretsiwa botsafa komofartatlenke a bona potsweki ya moentolee go tswalelapele ka botshelojwa gago fa o fetsa go tlhaba a motho wa kgona go dira sa tlwasingo s dira jaka go ikad aka gongwefela famothoa fetsa go thabaa emon a ka ritgoremu ento o na le ditlamorago tetsetsetse malwa pe dilenpeng okaupua ke tlhogo oka ukwekaremnele o botlhoko oka  oka uka botlhupgape fo o tlhadilenpeng tetey lo yal okaupu a tsatidilokau twatiphogo ki binki ditshipo kapa ditamorago te ditsa moento mme baitan e sa ga baiti gore ke pefeng tee o tlo dibonang weena mmongwe le mongwe a tlo dibonang morago ga a entiwa nne geraiti gore e ga ukuta otutoto nasentla mo mmelen topatapa ukuta ekare o lapila uta pone e kare o na le ntlhikela o ferogadibete o puekitlhogo kapammelwago e kare o na le  bokozanyanakapa  nsa e botlhoku gore uuketle  ba ko anta of disiase a disiase kontrol and presention sds ba   baraesi batsho goreko a gore o bona gore o phene e uketlile mo g itapoletentata totagoo le motho o ratangwya leko dijun mne go na lidipatlisisa gapee dilenkoni england jornal of medisine ke di bwang gore e bat ba ba kra moento wa faeda ba ka bona gore ga ba kra lemaola bobedi e ba ka kra dika moraged e di e di lenkodine go phala ka moento wa ntlha mme hagu ga go buuitsela gore ana go ka itapolisa ka go ekasesa kapa gautwetse g itila mo mmelen okaokao ana o o ka kgonwetsa moragwale  mentowa bobedi mme ba baisanapekanakoye emgon ba bona gore go tswa mo mmele motgore okaetayan tetse botlhoka ke gore re te gopola tata tsata re lebelefe djuug dimi ka bontidimong e di gupwalegile dika mogare ne raiti gore o ki rea thirele tokapamo ente o humolelwa gobe kamo mmelengwaga kapa go fireletsa kamano ya kohid  moragwa bepehepen mme kge ke soneso o tshenne ui  batbanaganeka tsone gore otlobobwe fe kamogare  ko baitira er tlegadithitoo eti  gare ari gaosiana kapagaokima o ka kgonod o thelogatithutoo lipayalo ne raike gore tikimtseditsithetse dibeile dithulaganyota go bontlha o ta go khusa gore motho a sa kgonao a thatagodie kotla ya ka gore kgadiletle lebatshobabatli gotlale ha ga bathgabaleklele go dirisa ditaulo ka bona ba dirisa  dit utabol ke gore ke  dithisupheiphatse o d o dilatlha mmoragogao didiritsa go nnega go batlialo botshano o tle ka lebotelola go nametsu o ka senenetsi kwe dipompong dja ka nerenwa ni npilegaeke gore falathena zuitlhakomele thata thata nne ophepafate le njiny yo yotlhe e o ka ibirisaka gonne dijini kapal e dilepedintta goreu uutaplefeneamelen dikamo gare go botlhoka gore o bona gore lee lefelenlo  yankopeng lle na le dithulaganyeketotle go hirelefa thetego ya mo gare ona thwene go thethahajie mijhiniyo yotle morago ke le uderisa le morago gao u dirisa ee go batlega dileteyalo nne e kgapele baitanapegakibua le bona bare go botlhokwa yapabone ba bona gore o ka mpewa enela betepepedijeu difete gonne o bona gore o nalithirelepo ya mo ento kyaakaribua ake gore tshonne oeme bekete dteo nne ke gore fela ke leanole beisanape ba bamba lebono gore lekaphuta gore gwatlhaoganya gore kot ya go hatsega moo  go tinang   mmo go talegileg go ka nago ko ko dimo go phala ga o le kwanitle ka paga o sekoo yonedini e mme go nne dijim kapadi tonefe di bitandi fitness senters tpe dimpi sete dibone gore  sefe dinale dithulaganyo te di thisang goisakopi ya go tshwatsega mo mafelong a bonekotlatsi go botlhooka mne gapelwenaut okomelennee meisaanapelidinyatata tisilen le tsone bare fela gaokaemabepe pepei re o bone gore otlobo o na le thireleto kenne okebeikirile komo enton e sengoro go na le sepe fesmomo enton tetherin o faya moragoga mala siamabedi enadika moragope ke gore fela gore e uite koti ya go phaega kotlahethata  go bona gore o bona goru u intehhentle mme gape ga golebeli e ga esanapebabangwa lebelete gore go dira galang mare momasatun a nkha n yetsetseba tiditang low ntlen tit ekesise igro o ka themasemakwa ntle emne o saeta diletsediti o ka itapolesa mmele yeetsa gao le motlho etanbediyoo ka diphilathit ke panatsooka dietang  le go bereka muntlu gore leoneke ka mokgwa o ka bonang mmene e bare hih intensiti le mmoderate intensiti ke gore go thanalo go kuka ditipi e go go siana gotanabaefikele go fwina ego go go sapa seneme le diuetse yalete e ledi kodimopeditirisang maatla thata o ka ena go tlela o bone ed dikota kapadisamoragotamo entlo di lekotla sepele gonne gao batle e  bona goro oka o ka ijapitsha monneleng o hatsipindi e ja moragopete ke wena jaka motho uhwedibonang a ka re bona gor gadishwa mmmo rona babokemme gape e monsese botlhokwasethenere fe gopolek gore ka nako eyana e thenerithokomela ga re bela koo dletetshanayeboddin o thenere rale re ere samaeka melao ele nkenkwe didin rerwaledimdimaaki re phepafaja a ka ntekidia kgape tsese botlhakake gore e resa rela dimaaki gonne a tla gantoo o o ekasasayanammele wa lapa o bono gore o u nna tsintlekamate gonne o ka thatabathe babang o tsa itilwena gore a na o thatahi gokwegala ralebogatlhe ke potsweeleng gore e ne e tshwantse e botswe re tlhaloganyye sentle ka gore motho ba tla go itsi gore botsholo botswalapele kamkho ke botlwtsinkaten na fela fa morao ga go tlhaba na ga go enta yano ra lebogapontor le bogidethataaka tsherimosetse eo ke tshepafa moretsi au zilesentle e bila go tlhaloga ntseretlauisalana gape ka moso ego leboga nna emon lethaletentle le baretibahaleki dankibaya meponsopilanemme ga dikangwa tsa polo a rebamo dinakonka tsa kowid masomaabe le borobongpele gaura borobongwe ke nakwa ditlhogotsa digantsa ura ya borobongwe"
"Spunik not being accepted by SAHPRA","419.91","e ketshedimosetso ya kowid  oitlisediwa ke motswedinya fem konkabokamoosolekae meepilanentenkenkwnanartsugila rnamatsapa raitsor gojetse nakotlhetsola peletlhepontswomnnn ntilo gotakoda tat afrikan a haparatraditu tartu yana resitankakhwitanyanarabelkek haphra e bega gore e ka he dimelle ekapa e kite enete eee eka the dimelle go re gudirisile moento o wa dpitbe gar ka go pola moento wapidikikoone o ne   ba iff ba neba baile bare o babate o birikilenne par kimolilale gore bare honadilepe gapha egana go dirifa ne ento o e tamabaka a nang a diipolipiknne rkatlhaloga nya mokgwa oo fakha o bertengatinsa pra gaoberekika tasepolitikika kapakamaparebare bona ba iperekela fela ka tweblinpen egure ana bao tlhe ba ba ba klanhure e ditlhareni entosin le senytse refebitantswanedi haut tradart ana batentse diletetotlhetditlhatse di ke gang gore bakgona goo lebala gore ana e ka tirisia mo afika bora mme saakhra ere intse e lebeleletsi ditokomanetse di tsilenko stnikbi ka moento o wa bone o garka go pola gore moento o wa stetmiki wee u dirilwe k kana leya researjh institut of epidemology and mikrobiology o  oo russia e sanko russia mme tatatata mo ento oo u dirisa netha e le mebedi ya dileteri dibijandi a dino birus  baked konstrakts e di dirisiwang gwedamoendo mme ka lebakaleo e go tsumolutse go nna ledipelalokapadid matshwenyego a gore moento o waspetnihi o ka nnakotsimo ba thomba banalle mogare wa ethal mme kgang e ke botlhokwa gare lebeletsemo afrika bora gon irac it gore rena lee batho ba paitsi mo afrika bora ba ba phelanka mogare wa et ilne go botlhopa gore be bone gore moente o ka pabaitsana peba tshepe gore moente o o ka setsisepe mo batlhonba ba phelanka mogare o wa eth n nege sapha e nee lebelletsi dipatlisiso tse ditamko e unked ede ba kupilelee dipatliso tse dinumen kega ba begaforgaba dikriato dintseo kapaditakomane tse ne ba ditopa gotsopo diputdi gore ba kgo no bona gore ana mo gare o tlotatopamo bath ana o  mo ba tumba ba nanle  mogara wa ithak o berakayang ne santlaki gore ba ganne goreng emejensi us ya mog yan ya mo ent oa petnik bi kolbert  gonne ba lebelepi gore dikli ni khakhael thisi jakine dibontlite gore  kunalid  tetnoloji e birisiwang mutbutmiki ga uprados yago ya bobeli e ka isangkotsi ya motho gore atshetege ka his ko go bimog mmee a ka re tlhaloganye goreca ako ege saphla e ne e kopa ditokomani go tswa koo e bapudi bi gore ba kgono bona gore kusa galang ka kotsi e ya htsatlhatsago ya etadi go duno mobalel gaba kgona gofa  saphla ditokomani ke di tshoka gang rbakono bona gore ga gona koti eo mme ka lebakaleo e ga gona bopaki bo bo feletsen ba go bontlha gore mo ent owa stptd aogaona koti mme ga gona lekotsi ae ka tswa mmooneckika ba ka leo staphla e fa dunenagoremoento o o dirisiwe kapagota imejensi us ja aka ne ento e meng e siterebony yona  rebionkayona ke fesa de johnson en johnson nne e rebiw e kapa faphha e tere dikgwedi di le e go lebella gor cana moento osktkb o ka birisa ne yone sektion twety e aprubal k yona ya imejensy us  ibta seton twety goren muriana moento o birisiwe ka ka pele  yone ridita seton  aphrubal ne s wnaphubali ee kiamoentowa pitniksi gaba kgomo go fa dikokomane to tsotgi tse ntlhopegalang mme ki kalebaakaleo sapla e paletseke go fa sen tyne aplikation e go hpitniksikanako e yana papatsaparelebelletse gore benanobatubab i ba baphelanka mogare wa ejhi ga re lebella ipaelo dipalopalo tsa ruhatsa batho ba ba phelan ka eh ard mothu o lommungwe mo bathombale ba le batlhano ba ba le modungwagente tetenkkhalakothinine ba phelaka moleti eka mo gare wa hirare karka leballagape raitelegore re thaborwa e nya le e population tapatsejhaba sa batho ba ba phelang ka mogarwa h i ee ko dimo gophala dithaba tse tsotle mo lefatlen mmee go botlhopa gore re bona gore e miento yoophe kitsamasen kakapa ekafeletekotsi moo bathumbabananle ethai kapa ekahihitshatsago ya ethi go dili kanako ee moe putniki kahibirisiwi emand nne go katahela gore  ga ba ka e tla batlifadi akomanesa twetlitedithakiuan ke saphra gongwe  saphra ekalebelela dipatupen ne ka nako et moente wa skitnik dic gawa bontha gore oo o o bonthite gore gawaefa dihaft regulation tsa rola ne bontsita oka nnakoki kya tsa larapaleo tabri mohetlabore ke tanatakajiko emonota ara lebogatlheponsopilane moijaanape wo rona wa ditlhaletsano tsa boitekanelo tsholasentlar tlaisanlenagapeka mosotholatentle e emon debaretkogaelntlola lemmapobebipatharalta"
"Pegelo ya DIGITAL VIBES e bontshang ka mo madi a rugilweng ka teng fa batho ntse","436.62","e ketshedimosetso ya kowid naoitlisediwa ke motswedinya femo konkabokamooso am e no negonkienyone ke re lediweka repot ethileng go tsakoo efau unit mabane e duanka gore madi am egwipad dthereo tsa ditirelo tsa kommunikation tsa kowid n madi ao  aditse ke a na aiditseyang auaujitse ne gape gore disitshaubadi ea diseng ka thyanete ena ne santlhe tsheresebononk gore ga go lebediletse emoyonecdc komanitwe efhadi dinet editereng emlint million e ne e ne e e baitanap baditan futles and weed wet for ekpendita ke gore madi a na a tshanne aile gore a thufeka ditirelo sa kohid  tsa khnike ile go dirifiwa ka dilepedile nne ge e ethinilele e iterekione de taobad eripen gore e anile ba baritsibakoo le haphelaputikanelo leee pe naya kgale ele dar selethisene ga re lebelayanagarea gartpe kibalebaipanapeta madi a ga re ka nebela et milin e eka epang kapa e kabe enke bedipeng gare lebela dibaetetaagaeta ga rer lebella dipajete tsa kgale pa di lehaphalabitekanela et milien erand ceb tsaanapebapa haush ekonomt sa re thalheta gore e tshimilene onke be e thisitse lesaphala bitekanele la go thanalelapo trasesinia isten kape nde ba dirisitse madi ao go reka ditirelo ke nntsa bitekanele go tshanale otepidik and khrostetik ke rega bathora gorieng eboletse ba sikiri bo bokodimothatamo afika borake batho ba bantsi ba ba phelanka boletse bao mme dipatlisitsokapadi  d dimpalopaletse ditanko stiear afekhaletse ditankolo sa phelapite kanelo le re bontsa gore batho ba banetitata tsotako magaenko meheg segaence hba kgaola maotoka lebakala gore bahelletsi ke gore sitiri e ba gapelletsi mommeleng ne baitsanatebare ta wa ga wa  ne tt ethlilen e e julenke baaditha badsi lee ba ba anile ke yona ba lehaphalabipekanelocnjebe dithutitse bathobao ba ko itenkhep gore ba thusege nne ke dulote dingape tsenke be di diriseditse k et milineke be diriseditse go thutsa ka dinitution probram ke gore raitse gore koo dikolong tsa bana ba ba sopolang thatatshata o ka bona gore ya go phiwa dijo kapale  gore bana ba thotio ka ditirelo tsa go thanalee  tibelapeleli gore bakireye di kgapekeng di babone baite di itest gore ba kgono bona gora anagna mathatatapamaleti ka mathabone le ditedetsa bone madi ao nkaba a birihite aoukiseng nkaba a birifite ditirelote diditnititeu me ka nako ekaitsehoreu le mo dikgang peruta ka yone repoti ya gore go biragala me gakibua le ba itsanape kapalidi aktiset batho ba ba berekelang fab tikanelo gore re bone ditirelo tensnesentlem ka bitikanelo go thanalebaako bileka imali bileka emali balelela madi a yanko lethaphenlabtikanelo gore a diriswa yang mne anar dirisa ba  puso e dirisa madi aohentlearb uthisa botlhoputatat inan ga rlbal madi a nke ba a dirisitse go thusa le kanako eo ga nesentere tloka madi a go reka miento  p  emilieni eo ke sp ya madi a nke ba a dirisitse go reka miento  ga re meballa dipalopaleta disanko lehathala trejare nme re tsha lebelafela madi a jaaka madifela a tsaneileng tapare bona ele hela phenyo ya madi a rona mme re na gane gore ge madi a sengwa e ko lefaphenyabtekanelogo na liditerelo tse nntsimo kabora tedi thotuan tedi sa gono diragalang ka lebakala tn eo mme kanako eo e gapere gopolele gore mo nwageng ofitileng re bone gape lee e madi a t asniwa ka lebakalaphpi re bone gore honale ba g a banti ba ba kireleng diletsa ppe mme e le e se ba le mo molaong meng  madi a mantsi aoga a diriswa senkle hese botlhokake gore gare lebelepyana re bona gore anna go tlotsewa kgatlatsa molao di tlotsewa boba ba lenteng ma nne ba dirisa n dia baokipemadi a re bona gore tha publik finane manaement akt e a bontha gore madi ao ga a debisa hente mme kanako e rene pehutla gore kutlo biragalanka batho baoesbutlhoke ki gore sentsera le mollera borobonlena e mon mmee a ka ripineribua mabanere o gore la booneluoltlosimo lula madi ao nka ba a thusise thata thata go thusa le gore dikgantlego tsa gepeng mo mafaraphetheng a inthanet le mo mafaraphetlen a bitapolotha a bo thana lewajap ago tlhana le thetha le fakebook nke be a madi ao a dirfije gonnakgatlhanong le  dilepepotheterek dibonantsee thennete ka kohidn mme keo e tsameele ga gona gore ga rit kanako ega kiboalewaitanapemabane ga kifetsbala repoto e ke ba botsegor anare takirea md madia aore kakre gabar gap kanako e garit gor ana a tlatrewa mere telokela baba utitseng madi ao ba tla bona gore ba tsharitiwa kapahet letesekabirgala ne ka jeko emon pe tonatakajeko ke tsa du botlhoko mnee go botlhoko gore le tsaneribekatsoneg dianma lenaaneola ronna la kobed n la meento le ditirteita ditirelotseding tsa bitekanelo tse nke be ditiragetekanako e ritigore ditirelo tsa ronna tsa bitekanelo dinedi ethannaatintla kanako ya kobet hunne diletso tsekhe madi adiribabutekanalobabandi nebeile go tlhuthaka kowed respons ya runanne riponarelega ka nako e yanake tana takajupo emon raleboga ponsor le bogetsenaakotlhetlholasentletare kopanegapeka mosomomosao thaasentle lee bareti ba thanhente"
"School children_s mental health crisis during the pandemic","559.32","e kitshedimosetso ya kowid noitlisediwa ke motswedinya femo konkabokamoos so wa go mojapontsopilaanee wa go mofa emonlekae retenlekaea reten a go na molatorepene repene repeneya oileka maask ya kere odijile ka maask dikresmose tsee o tsene sentle ka tonitonithuntse o jile maske ga wa thelolwakere wa re amaaskuzn wa afisa mankelapileaonakamgomonennanaonaamrkreyamosela o batla o mo dimedisetlhepelere tswalapelekatlan aka aeankwatelamanhebadbibaleeeemnwabon mosel wabonaewa bonaketwaebona kganyeke ibuang ya gore gaosimolebulena gsinyenenatotlhan gakisepikipetsamekipikibuisepindakinekoieiemogyn kananana monatlhatlaknyadilofelawtsi nere siaame fela go s na matsapea noo tile o thatlay  bona ba no batlotsanella bo malome he he wetyrt hee kemella basadio uemelna kokamona tbanipotyga go phosorenge gomkote ee o tenga ke repontswata r tswlepelekatsed bithopaeesiameke repontswakekkklake moseelakemo sela ke mo selake mo seelak selaskwatshoyoonao nabatlalentsela ga borphaneeeetnakan ewat le nnakemakaletkimakaleteyaponto akerse tiroo ngwananako ii letlogala bababediba ba ta gontsa mo sporomba a kore bue ka kohid  le gore eama banabarona jyan mo ditlhaloga nyonka horkets gore gona di gwetletse dimmala nyanafalelefale eya e nannogamput gante leraborobologolula tseteletimolotenteribuaka gore rebonna ilmo ba tumbabagulo e mo erthalebelegore bana tjapatapampikanalobatlhaloganye ba bonele gor malete atlhaloganye a berkayan nejanekanapo e yalamikaikanapebata a boleti ba tlhaloganyo ba bana thapathapani en thalta kolejist a ka rebabotele batu ba ba tlhakomelambana ba tshogile bare gona ba nale maplhenyega a bonn khatapa gore ka motlha o bana ban bipikanelo bona batlhaloganyo le  bilokotlati mne gapelii e malweti a tlhaloganyo kapa e malwet a maiputa bo didiphesin di letheyalo a i lekodimo thatathapa mo baneng ka napo e ya leroborobolemme thatathapa bothapati gorec repalirel lebana gore anna le bonne menthahap ya bonakapa mpekanela ba bona batlhooganyo le maikuko be ka mayankanako e yana ne baitanape ba tlhaletha gore gwa bontla gore kapatsata le maphelwa a bana a a kilemoklilengka pagonalile ke dikhakatlhakaneng e le le bakala kofid   e len le bakala gore  remolero boroborlena mme ka tataparaitfe tipona ke gore banna bad ne da bannyabatsa gonoyd  dikolong ka lebakala gore mogare o o mme o leko dimothata rele moleraborobolle neka feo go boni depresion anajeti e le ko dimo thata mo banneng kanako e yanay ne mo banneng ba ba ko tlafitlafe moo dikolong mme baitameka batlhalosa gore kho na le mantahalth kriseskho na le mtaa mo banneng ba mo afrika bora ja ta tepa ka lebakala gore bana ba khokgonto ya bana moo malapeng ka nako e re bone dipatlisitso ditswa gitako gauteng tsa gore ka nako ee ya dilokdam e ne re lotona ga ne re bona gore d koima garbana goilekodin e ne e le ka lebakala gorbana neba betellwa bana bana ba kgogomtiwa kgata nebatlefekogae e ka nt ka bontinebatletse lebatho ba bone ba baetle ba ba tlekatan ka mokwa ona mme ke le  bakala gore ga o feuikolong katatatsa bana ba tlhabela kapa le ge nesi re ha boni bana ne ba tlhabela kgokgontlo dipetelelo ka go ya skolong ganne go bonne ka katatata ka twenkitwenki ga ne re le tlhakammo dilokdawn nteneded tse bana go rbajayskolong go bone dikgokgontlo ta bana c odino koboni li dipikelelo diapodimo mo e sentala mo baneng ba ba tutana le mo baneng ba ba thimani lilepodimo ne baitanapebatlhalota gore dilopeo ki tswonetse dietsangormai kutlwa a bana le    biitekanelo ba bone ba motlhaloganyoun ne efiloted aba baitanape ba selebelang e le matshenyego a tjemegwo bonuokorogodiragalang nnen koyko uht ko unity op kade kampanalmitanape o biswang ka sofiet profesa jovn hadmen o bontlanggor na lebopas ba gore diphresen le ansaeti ile koodino mo baneng ba bayamkolong moo banengba ba tanatekolo ka napo ee hinulotenkhata garepana mo leroboromolohulla kohid  mme kekgapolo gorege bana ba boela polonyana barita bana le bona barwele a bima go ne babona gore bana ba tla bana le matlhatakapa malwetsi a mtek a bmaileta a tlhaloganyo ne a bmaikudo ka le bakala gore  ditented diragala me kana ko eyana ke gore le bone bana ja karona batho babat babagoloteretlhoka  thusoka bipikamelo ba rona ba tlhalogani go botlhopa le bone bakirie   ba kirethutsoka kaka ka maikutlu a bonekanako e yana gomne o ka bona ngwanagago o mmone ikare o tlule mopelen o tule motaelong naganake gore ngwana gauppi o o abella diletle yaloyale e le gore go na le maikutlo kapa go na lebilo  biitekamelo ba gage batlhaloganyi go na lebilotwe di badira gallang kha wena zuile  piron lebati ba baheteng le bonen mme  gotshwana le ko thabla l a kikiraygopola jhaudlane kabunti nekgonale nomore ele e nabile i ne nale adlepe ebonthangore   okaleleta nomore eo gake khaganye nomore eo ya o edd hikad hathele e berekamme kgebapadi barika bana mongwe lemung o kgata lang ba namookgaufile bone bakaya ko jharled lyne s e dak ob dak bed e bayakokonta atlhabatanmo mafaratletin ao ba tlo  bona gore go na le di online kounselin thatren ke di thutang bala pe golokolobana gore ba buyaka mathata a ba bona bana le bone bathorabaitanafa barekhaltita gore leroorobolego lulela kowid  le ba tsentamos tretlen le bone re fa naganatlela ke rona bagolo ba batanandu ye bbathanang ba ba nan le tretka lebakala kowid  ne khaudline e na le in e ofisi mo diprobentin tototle gauka yapoyone tharldlyne se tap orj d det e wareko kontrakt as leka bona  di rijinal ofises tototlhe le yone thetrni ew e e thusanbane eelentle go tlhutla bana gore kge bana batlhoka gud bua nemotho e otsenmotla ditapababake o bua l mothanekutwa bone kate ditsabatsharen hintle ee go na legapenomoro e ya n n se e ka founelwa moo e o ka eleletsa mo nomoren e ngulenngwe ke twfo aw seen deuikiyoney alayone wan wanti  gao le ngwanakapa o na ganalwena o le motladi e ka re bona gore ngwana o tshonyega maiputlommi gauutepankaeneng go botlhopa kanako e ga go boelapolong re nke rebona henterekhela ka leroborobole go lolela kobid  gore le maiputlobitekanel jatlhaloganyelab bal thabana le bone gopile go bona gorekgwetiankayon ke tsana tsapadiko emen le mohela kaleboga ponsopilane relebogetse tshermisetseeo gumpinr tlakopanaga pelanaka mosomo mosongotlhoresentle telapenke emen ne pela lemakoben kaleboga le baretikogai"
