"episode_name","duration_seconds","transcription"
"Matshosetsi a go tshwaediwa ke COVID-19 ga Baruti le Baeteledipele kwa dikereken","404.23","rekitshedimosetso ya kofid  nauitlisediwa ke motswedinya femo konkabokamoosoeen nere ba tlahits rman ee ya tlharra witsigompire r totilematshusetsa a go tshwaediwa ke kobidn ga barutele baeteledipelikwa dikirekeng ka ntlhaselo setskwa go dimo sa dinsho mo afrika borwatlh eee eikini katane ttaagane kbona goreretantserabnyapaone gonne tpakika ba borokodun mmee ko rtifimleka go dimeditsa ke bimedije e mwan mosela le kwa koladirage gammogolebareki ba motbinyfen ee mogaetu felo ha bintu fetokwa odumomoafeka setlhonamatfetsia gore barutin ba goge le baeteldipele ba dikerakeng ba tshwaediwe le go tlhokafalakanta ya kolid  senotli diragalaga bateletsigo gomopamakapafalernan ye bo tsanantsa dpirlophi tson mme tlehededebetled goreo kot ia gore baruti le baeteldipele ba di ke ba ka tshwaepegang le go anamisa kobid nanten go malapa bonan gorta go tlhokafat pa kinkedyakotutlhin baruti le baekebipele ba rikirakeng ba fanaganiditio ee tola ya go gomotsamaloko aa tlhopagalekeng le go tlamaisa perlophitlo tsa bao ba tlokafeping kankla ya kobidnen mordmon uy jaana aren kowidnn gaitokikiro ke reibirang ke dile fa bathong batlapahan batlhoka dikirlophitso ke dinyaneheritin le baruki baleteng kudieteriapei mordononenotha jaana aren diro ya rona e ba tla gorere the tleke mano kwa rona fa ba le nok kun le ga gonye monakonga janan go na ne ma pifefi a go tlaetega le go nya mathelo a ronalea batho ba re baratantata mokotin mogaejo henthe ente bauti le baetidipele ba dikerekeng ba solofetswe go nnateng ka namana kwa ditirlokitlou ta monakoa bonan gonnateng sa bona go sante go le botlopothatan ibile tsenye ke keretle einteng le balekoo ka boonang mogaitsho barwiti ke banoy ba batho ba ntla go latolelwa ka mongwe wa putego ya bonan ne moragoga wa mognatapidin morite le baetadipele ba bangwe ba ekemalela palionpe ga tirilopitson ka nakon ya perlopitso le morago ga terilopi tsong nega femo fikiagana banna mo botinya go tshaetega le ga nanisakhobikwanting goba malapamua na ga mmogo le go bato ba ba amanang le bonan gape go nalemathoseti a go tlatafana moragoga go tshaetega magaetso etibianya gore go na le baruti ba le bantsi ba ba tlhokafetintantla ya kukantin i diibefeno finlile di di tlamoraagoetedthofia ma mo dipirekeng ye mo baging ba le bantun gonne go bona morutiomonge gapeng go tsa le baka nne go botlhokwa huiti gore felo setekobidimo fa dintsho gafitlithifela mashoheti a go tshediwang gotla go tlopafala ka ntla ya kohid nntin me tsediditsako goreng gonne le tshokego ya barupi go ta kanita dpilopitsn le go fana kapotholofo ya he mooya go bakireekin t muyel dipego tsa gorent di ke reke dibodile baruki le baipedipele ba re nantsikantla ya kobed nandin go ranla lefahn thekai ke dipego pa gorekwa dageng ya undian ke rek ya katudi ki ileya tlhokafalelwa ke baruti ba neletsumo lebonong mo malating a le banyi nne ke bawe ba baruti banma ba ba tlhokafepin ka kwibi ya moranan lo moagam ko lelile gape gore go tlhpafepe bariki le baekedipele ba lemagolomararne ba makotulike mo lemonya kmpiki goya y kwalageng ya umdil yan dipego te dineka gren kwarageng ya myanma mo dikehonya jenthta baruti ba karna mafmamarataront gotsa mo dikerekeng tle di farganeng me di kgwebindelettaaron e le mmare ga hedigong le phuke moo wagany nne dimologaeng go thete go bililekaa go tpafala ga barutin le baekedipele kwa diperekengkantla ya khoku dine o go topilete gore le fa bona bariting le bapeipilepo dipirekeng ba fatshwanen le bad ba jeri ba dipirele ke di tlokagalan katamukutibilen le go laolapanamo ya kohid nn ba tlhwpega de go tlhokafana kafelohko hodin ibile fa banyelanna ka dik lota keraken gabaapare diaparo tsa go ithireletsa gatanele kohid n biaa ka go dimega ka badiriba kutita nenon mogaitofene ke khaokateraganno ka bonapodilokganagalang ne rotlen go a ka reetsale bona barite le bapiipisi ko ditireken retshwaneke gota maikaraben a o ithireletsa le gohiretsa batho ba banokgakanle so tshatega kgota go tshokafalakanta ya kohid  mo botlokwa go bira tedinapelang bona moonte wa kolid n ka bonagoje bokganagalang fa nentlalaga goihiphileng barute le bakebipini ba ripiraken ba thone ke gor sala morago le mawana ya lao a m ga kobednanten fa ba fa mesa ditarlopitho ne ba tlhwanetse goefoga go dutsanaka diatlam gape ba dirisekitsiratasbatlhego sa tsibankolemolin ka tnyakotuisen go tlhokwa gore ba sitshwa rehehatlego ne ba ka toganye ka thanolo ka knakothuken a balwala bafe pire nabatka atkafa lekeng bo go be jan fa baitemogela mathao a kohid nten ba ba dibedikepo ka gangwe fa ba ikemogela mathao a kohid nen ke go itslhaola fa baphetegi ilen kota fa ba nlille le kanamo le moto eka le go   le kan kamalo lemotlo yoatshwaditswen ke korikapin mogaeto a re dibenkathata ofiraetabarupe le bakeldipelele ba dikirete tfa rouanan padialomogaetopalapen ka nlapele ho bedifahe ta fatlegon o jibipolemolenn ka pamape go tfa nakelehepa netutwany mahmamahikin kotad pnadikwakiye kmantaaho o ka toganyele bakadidimnaabon jinganakhe kya nona ya  lebogaho le de e dilele kahoaeere lebogiletla daktamolelekwa oke dakthagomotsegamolelekwa moitsanapotsa boitekanelojwa tikologo thibelo le taol ya pa tltsa malwetse go tsoka tshwane yunibesity of tekhnology"
"Go bona moento wa bobedi ko lefelong le lengwe le fa o le mokgweetsi wa serori","377.14","e ketshedimosetso ya kofid  nuitlisediwake motswedinya femo ko nkabokamooso so ore tsogila renamatsaparalebogatlakaitsi gore go nale moret ba tlangomoaraba o boditse potso moo bekingifitilenko thuloganya nnalonale mamalindi mefela tla re thuse moreti ka potswo e o khono o mwanela karabatarutlwe tswedumela momalendi ki suuma ki suuma momalende na ke na gana goreng mo dipatmente nyarnadintorontooro ke ba toa bantsi baele gore bankile moa ntwa ntlhamamalendi okrya yateite e ba gofile nyone okreau wo mokhauntremamalendu o botswana boswasilente ao bono o boela gape gore ulonka moentwa bobedimamalenle gokare kabamente kaseba gore ba ga diriaenye gore meebi ba kapkreitan tsetladirang gore meebi le f o tlhabiliko ba rastembe ka ditawefitlha mee ba ba go faesemeesenyaana ba bo riferela sammweko tabongolokoteingo ka reyalomamalendi kapamentarneka e kapkreitadisistimitsa bone ke nanago ka nna petereyalomamalende tankenkakeansa potso ee butlhakwa khatanney har ka gopola gore mo di bekentetipileng legaphala biitekanelo l lelape ga kganya gore go nana batho ba bantsi ba baileng bailo kramu entowantlamne ga baya  go kramo entowa bona wa bobedimmen lefaphala bitikanalo ke ge ditlhalotsami btotsa lebatho gore totatata bailo kramo ento o wa bobedi gore ba kiretshireletso e heditsenkgwaoka go pola gore morago gabek matsatsi a le ftt o tlo ke ke gona o tswanno o yeng go kramo entowagoa bobedi wa hlaja ke dibeke tsedi raparotseo morago gapo ot uilokram nt op mme okakria efenes e go blelang gore oyakae welapolefelenagola go enta gore ukremo ento o mme gwa tlhaloganya gore go na le batho ba mae a ka morepadwa gore batho ba bereta ba ba dipiro me ntlhakapheleley lelapa le ma baka a mang a e tsamkorbakgo ba sa kgono go boela mo entwa bobepi mmee lefathala bitikanele lerrekwetsa gore o ka naya a ke ra bonaganani emontototota jaakam lefafhala bitikanele leba tla batho ba bantsi ba entiwe nee tsa di wok in o ka ya koln fileng a mantsi a go enta o hena yona apoinmenta gore o gonotrea mo ento kapa oka fonelal o kaleletsa yone enomoro ee ya  ya kohid  gore o ba blleki mathata a go kapa lebaka la gore o pallweki go ya kwo le felenle e o notso entualantlha kolona gore o kgona goya pa lebakala gore ke bathobabantsi ba ba ental een kapa ke ba thoba bantsi kanako e ba ba tlhokang enteliletsoyang gaw ka nako e a go na gore lefaphalabitekanol lekae tsa maen maano a gore thusebatho yale mme gaoka foumela yone gaokaleletsa yone nomora ya hotlaine e ya kohid  o ka kirea thuso  mme batho ba koo lefathalabitikanelo kapa ba hotlain e ba ka go thusa go gopota moretsi hotlaine eo ke o e ynne trpo nn mnik ione eke khoselta e ka thisan gore o bone gore ga o na le dipoto kapale mathapa a o na lonekago ka moento ga re ka gopola gape emon haribuakam ratlhalganyo go nale mabaka a etsang gore batho ba ha nnapen kwe ne batsho neband ten ne go retlhaloganyekapa rii et goren e a go re tlhaloganye kapa lethaphala biitekanele wald harb organisation la tlalosa gore re fa ena malatsi a feta hfo piliro krame ento wa bebedi ga o kerele mo enpo wa fadar mme ge aka ka lebakale ga o tsamaya kapa o le fooe matsati a gago afotithu ael a tlophita eskhale ke nnako ya gore onke bofounela the kobed hotline gore o krie lefelo la bopedi koka ile trame enpopen mme ka nako e yana go mme nafelo a go enta a dumeladi wooking lega o kaya o sa pomela yone nomore ena waya wa batlhalosetsa mathata a ga go kapa nabaka a gore o palleki go enta koo one gore o kremo enta gwa bobedi koo o tso ent wanten lanha go kapatlhalosetsa ba ka go thusa go botlhopwa kanako e yana raite gore moento wa fesa o go fa tshireletso ga o kirelelomunwi me go botlhoka gore o trenyi ento e le me bebi gonne e ko gofa tshireletso e ko dimo go phala ga o trile moento o lemongwi raite le kanako e baitsana pebalebelepo gore rekate amo luonla boomne lam leroborobolegolole me ga reenetsi ee tsonedilotseon e re bono gore eretae re rekria thireleto ee tlhokiga ee re tlhokang gore re sa tlhwataga ke kofid  ra gapelela lenommeleng mme morettotatota kgang ae botang ke kgang e le le paphalabipikanolo lebono gore ke bothataba gore motho o ya kgwilokra moentowantlha mme wa bobedi go na le mathata kapa hakipiking kare go nale ba therbanti ba ba saeng khwilokria moentowa mone wa bobedi ke tswana tsa ka jiko ra lebogaponsogutlogetsitlhe ee retadirafela gape ialo ka mosomomsong o nnantse o itumela ttsilagawkerenee uitumele letatsilaga ho lena lena mofela lemakobedi le barekikoga retlauakaraleboebgtlwge"
"Teenagers and inflammation after getting vaccinated","421.47","e ketshedimosetso ya kowidnoitlisediwa ke motswedinya femo konkabokamoosooo pontsoonelaenekatelekatenenonahnamlatore tenre siamerale bogatleosiama ke r re ka bua ka moentole ana ba lentramejeneeya emon ee ga r ka gopola gore gadi ga buhumolola gobuaka moento moo e banang ba ba lemo garegadinwagatathwaf e hdenpink legaphala bpekanalelaka tshwepo ya gore bana bao ba tlotra moente lmmon wa faeda hini ente imidadi a kare bona bakhe ba botlheba go tapodi ngwaganta etigo ya kodmu ba krami ente ilumidate lebakalega barepile e molwanoka go polaganekitlhalotsa baitana pe ba tlhalopipe gore ke ka lebakala gore go bonne gore ge eebanabab mme dipa tlistonpenen di diragalako masatheng a mangw gare ka go polagape gore masatshe a mang a fimulula go fa banaba me ento pelerunare ka semulamo afrika borwa mme ge peleba peleba ba dinagatseding go tswana leimaete kindom le uf e ifa bana ba mo ento o neta dipatlishiso ne go nne re birita dipatisso te thwananpo gom gore re kgono bona o le dipusole lanenetea atajukameti andeis di taya tshwete ya gor go diragala go bone gore bana ba bantsi ba tata pa bana bababa tmani ba bonge gore ga ba trami ento e lumudeng moraagwa mo ento wa bopihu wa faesa ba nna le go tshoratsione e ditang mmaiokhaedaithe ye e lengboletsi ba inflamaton kapa goruruga mo pilon ne e ka lebaka leo eleahalathekan o leperuphetota gore go nne go bonwa dipatlithitote baitana pe pa rnamomo afrika borabary ere rrife go bo tlhoko gore banaba ba hireletlege ka goka ba tomokotin ya go tshwatsegaka poetmantley mme klhe nne re lebellelo gore ba sireletega itla tmme ga p ewo khetso ya gore ba fiwe n e moento o lemungwi wa faeba gore ba kgono bona ba hereletilile mme tatapapa di dipatlisitakapa edi kamorago pe dibonintsa gore mae kaydacki ya lenbulet ba g rg pelongg le pherikadats bneki ke di inflimation ka mopelong ditsa biragala mmee  ka na koeyanarait gore ngwana o le mo garadinyagatotha le hein ata tramu enpo wa fasa o le mongwe mme kaiti batho ba banti  baip rngleanitlhaltalefaphalabidie la bitlekanelo laatlhasa gore neba tlhaba go bona gore mayokhadipt e e ka nnapeng gomne dipatisiso dibontsito gore ipeng nne le mo banneng ba ba timan i dilite go phala moo banneng ba mod ngwaganteta thop gopitlhella thop gotlela seenin e ba  bao ba bontsita korbana leyone mme ga go lelwa dipakisihetekin gore ke eng okapa ke en tetetankorepgomne lekopi e rataanape ba tlhalota gore banna ba ba molingwagentetshwa kotlhela s ba na lee tlhante kapa bakaetswa ke ba ka tshwarwa ke tsone kapa dikamorago fa inflamation mo pelong e kam ga ba ka thatigake mo gare wa kohid c o ka dibagala ga ba katshaetaga ke kohid ba tha entiwa bannae bakatshwara ke yone e inhlometon  mopilong e ga rataro go kitaga ba tatradeli kapamoento nne ke kale baaka leo gape ga re ta go pola emmalleri anape mo dikgwedintenterefuta le lefathalabipekanelo ntle lera ba tlo re kgalosta gore mnoo molemong moento o molomog kgo na le dikla morago thetlo e lefathalabipekanelo raitsanape wolkhaut organisation hha pra tds fd e e tayang gore ere rre hentere dirisa moento o kapa molemo o le ga pona lidin ekamoragope gore  dibenefik tsa go rea moento di fe ka dibenefik kapa d dis adwantaje o kapa diklamoragope tsa gore o ka lwala mme taitanape batsatlheto ya gore re tloo go balantsa yang ditla moragope le botlhopwa ba go rere firelepe  bana ba kore batha ore ba tsathatgati kobet mitharelo ne kika leba pa leo  go tirinthete ya gore le ga go na liditla morago e yana go botoka gore ko tseuwe tshwetso ya gore gup bana ba fiwe mo ento o lemuu bae ba kgonosireletswa le ge ba sa sireletsa ka bootlalo a ka ritsi dipatititdre bontsa gore ne ento e ne dediafaesatyone oprian  tireletlo ekodimokapayab kalogo peteri ba krethireletso eng e ya mo ente o lemonygwe  go nnafela gore batha tireletega go nne ga ba ka tshwaefega dipatlititso di re bontsa gore bana ba gapella ke boletebo kapa kgany e ya imflimeton mopilong e nnakwa god khata kgaba ka tshwatiwa ke kofid  kapaga opa ka mogwabakaetran ngwanne entong ne ke ka lebaaka le kaitul mmakaratheten a ditapoleto batsadi ba ba ntsi bantebamputagora gore nyalonnatshonipisengwanaka go ra a intia go na le ditlamoragoditamoaoth dinitedintamoentok mmee lepaphala mipikamelo latsaya tsheto ya gore e nne moentok o le mmouwi ka nako e baokambana hutlela go bona gore e diklamoraago pahad information dekade rekuayan ke ponetakajepo emonnogatogalaponsoralabgtlhe lnakgagot krekyaitsi gorolwena o tsenemotirong swanna thariman swana tharutse tsa maeman go o bereka o ba li taotsana ponswase blef ya a le bo gre tamsenna gapekamosoponso knkee kepat eerikrogela k moselekiaitsia thoanako jaanaako mothokiban eou kraoli"
"Bokgoni jwa banna go dira bana le keletso ya thobalano le moento","421.13","eketshedimosetso ya kofiduitlisediwa ke motswedinya fem konkabokamoosoo potsoki kekekekepuo eleng gore go lo bakanyaanakutla borrebabuaka yona gore ga o tlhabile moyanto ke te  oto o tlo nna monakong esaren eesareng le gopalolwa ke go dirabana le keletso ya thobalano e tlabaetshaba e tswa mo go wena ga ngitshoro ka nkarabelayna yampotsoyaenon ebuanite kgan e ntetlet moma haratlhetheng abi tapolotso leemoo maharatletlenga intanetnne sese botlhopa ke gore baipaanape ba sentabalebeletsekganye mne ba boni gore moento ga o nna  ga ooka he hetole bokgoni ba goeta ngwana kapalekelepo ya thobalanomo bore le mo bomne a kare bile mo bekeng efipilen mme tsa tse boniwang papatee baitanapetsetse batho lebelepe ke gore mogare wa kuped  o ama bentateyan mme tsetse go bontsitse go nale moutanate bako uniesiy baitanape bako yunibesity of maiani ba lebelepe gore a batho ba borre kga babo gaba ga ba tshaitsegile ka kohid  go na lebokgoni ka go na lekoti ya gore baka se mne le mbana kga ba tshaitsegile ka mogare e feng moento dipatisiso di bontsitse gore ga go na moento gawet sepe mo ka lebakala  bokgoniba goeta ngwana kapa lekeletlo ya thubalano mme titaana hentsebalelelete gore tlono egenk motuarre wa di ngwagatsetsotlego go tumolla ka eengo ya koodimo geba tlhatsegile ka kohid  e kare go nna le mathataka ababokoti ya go bona gore gudiragalang mooe borre mme dipatlihkotsa legane lepatlihiki e nnyani khataraiti go re rrata dipatlihsepenba mme    dpaitanapeba babapoo dretmaiani ba bonno gore ba lebelletee borrre baba baba ba ba thataro barne ba tlhokofe tseka lebakala kofid be ga ba g pa a tlhatlhammeleya bonye le gore mogare wedte mo mmelengwa bone go bontle gore mogare wa kofid n no ne o bontse gore go na leb e po bokgoni ba bona ba gweta bana tapa topatata bokgoni ba bona ba gweta bobanda e ka renedile kwetlafe gomne mogare o wa kofetmentin o bontsitwa gore o ya koo e nafelong a borrebatlokan bare ba khonetsa bana nee ibonilen ke gore kga goetwa eiditantlinafhithu analfe keyona gore go tlholia gore mogare o oeta mommeleng go bonta gore batho ba karreba tshokola thata ka bokgoni ba go elepa tlbalano le bokgoni ba goepa bana ka lebakala mogare e wa kowid n mme ga nne balebelesidipatlisepe ba bone gore bontsateba batiba nebaha  ke ba nna ba gapeletseke mogare wa kohid  mme oga go lebeleia go bota gore tatatata mogare wa kowid cc ii o tlenya  mafhole a mmele a tisanka  tubalano kgape le go bontsha gore bokgoliba gotabana mme ga pe baitana e balelelletse gore bontate ba fetifik ba ba ne ba trele moento wa faesa kapamoento wa modeana ko unitety go diragepeng ga balebelepe mme e go bontlite gore bo rreba ba ne ba trule moento mme ga go enta ba pitise go tireleta  bokgweniba bona ba goeta bana le go eletsa tubal no gore bo ya kotlati babontsipe gore ba kgomne tuta   baitsanapa ba bona gore go enta go thuta borre gore ba kgone go nnatenkle baeletethobalona jaakantlebatlwaefe mme gapele gore  seual health ya boneio otle e bontlha gore mo ento yathutamoyone mme e baitanapebababil gore tata tswata dipatlittso tsa moane nelle dnnyane go tlhokagela gore gwifue dipatlittso te ding gato mo lebakenle mme ka nako e ga go na bopakiba go bontlha gore mo ento o nna le bokgoni ba go thenyakapaba go wafatsa bokgoni ba go eta bana mo borre ekapa le keleto ya boneya tsubalan mme ke go tshwetsegatsa kofid  g bo bontlhang gore e ka re goka nna le mathata ao a ri bwankaon mme tsatatsota baitanapeba abababuilele gore ba ipi gore batho ba bantsi ba borentsa ba tshaba moento e le ka lebakala gore ba tshaba botlhoko ba mo ento mme gape le kam dikgantse te tsengnite tse di tamamomofaratileng abitseka mahartlatla a itapoloso lee  masartlatla a intanet a sa binniteka gore bokgoni ba borrebagwetsa bana ga ba kirile moento wa kofid  go dira ga layal me go a bontsha gore moento ga oet sepe sepe sepe go kwafata bokgoni ba borre jalo mme ke gore a dile baitanta ba bona gore gaoka enta a ka mothwarsprey o ka bona o fireletsa gore o kwasate bokgoni bo ba ga gobao ba go eta ngwana tapa o e gapele keleto ya ya khubal ke tsanetsaka jeko emon go botlhoka gore le ga ntserentse yana riti gore dipatisiso tsente dietsiwa mme bopaki bo paitanapebanan le bonekanako e yana ga go bontsi tsepetsepe tse go na nne bothata ba  mo ento mooe moo ebk bobaborre mme ke go radile kga ba ka tshatega ki gone bakatlana mo mathapeng a mantliti thata a bathabang ba naga na batshabelako mo entong me mathata a batshabelang ko moentong kanti a ko goneko kgonagaloya go tshwatiga ka kobid  ki tanatakajeko eman gapontoe"
"Dr Gomotsegang Molelekwa o re neela tshedimosetso ka Botlhokwa jwa go Entiwa Lek","363.72","eketshedimosetso ya kowid  nauitlisediwa ke motswedinya femo konkabokamooso o socc botlhokwajo go e ntio le getlhala obedi ka moento wa faesa go matlafatsaitshireletsokgatlano le kowid  mo afrika borwa ke bo bonsenjangey enanna ganego botlhokwa morata le go diditubulekad aemon ke dumediserekgotiga dimosela kge dija motho dimapatomapau lekokola diraage le bareti ba mo tediya fane go re tihumulatalajanamogaetekere dimidanetsa bagi ba thetebaentilwele kgetlola ntla kamontwa faesan fa e kale lnanoola go enta sejhaba le tsentse pedisongwi ya mo tlaganong emme tanganlutijaana gore fa o intile legatlela ntla ka monto wa fidalny o tharete go ya go intiwa lekgatla bobedi moragoga didikedi de thatarun ko tfamangati a le mathulamanyle bopedin hemoke go ya aka dintlhaakaelo tdibilwentiputso ya mologaene heto eno e terwe go ya kadi a tlegelo tsabaging morago ga koe ka fikiwa ga dintlha tsa dipakisitso tse di khakaletseng ne di tsupilia fa batho ba nna liithireleto ee bo tokwa kgatlanale kowidn fa baletal baka nyanga peleba kaya goentiwa legatola bobedi ka bonto wa faeka mogaetotla go pola horere saeremagayd olantabletmo bujhan ka mento e tsantleng  le minjan legoremaithomamagoloaputson ke go nye tefata fa bagi ba helepegileng ga tlanan ne malweti aa ma thitsi be bintso te di khudiwanke kohid  kikamoopuso ilwe nyataitsholola goentabagi ba lebantsile kgetnan tlakamontof pele ba ka entiwa legetlo la bobekningse mofra gore bup kya bagudile batho ba ba bokwa mo mmuleng ba se re tsofilego fe nene ka kanonbemabetsi amatshisin le bintse pe di golaganwang le kohid  pele ba ka entiwa lekgetlo la bobekioma rin o nalidipegota go ngodiga ga bagi go ya go intiwkgatela bobeding ne senfalamonnageng ne kwa dinageng disele go ranla lefatsinng fekaiki kwanageng ya amerika kwa goobugileng fa batho ba kanna diparsente dirobedi a fa ipanagatsa go intiwalkgatlla bobedi fa nako ya bona e nehitlhile kaitsianape badunyana goren go nale mabaka a lemantsi aa tlhokaletsa m batho gotseye go entiwalegateba bobeking le ona a ka retsa kalatelang go nale batho ba bangwe ba ba katswang ba bonyi tserimofetso ee fothaheteng e itiseng fa go e ntiwa legateba ntlam go lekane go gusireletsa ne bekutli ba ferinthileng lebaka le lengwe ke ditlamarago te ditsasiama moragoga o imtiwan batho ba bangwe baka tswa ba itemogetse ditlamarago te ditsasiaman fa ba fenya gorympiala ntlhan le bate thetu yagofile goempiwa lekgetala bobiding go nne ba fa batle go itemogela dikamalagopo gapen batho ba bawe ba le balago ya go entiwa lekgatlala bobedi go nne ba le tasebakapele ba kaya go intiwalegatlola bobedingg lebaka le le gorenye batho ba bawe ga bae go entiwa legatlala bobedi go latela ke letsong go tswa go ba tlan lba btekanelo gohedijalo ka ntlhe ya biitekanelo ja bonengapen bothwata jwa go fithela mafeno a go empiwa bo go re jabopametemagaeng ga mmoko le le baakala gore bagudnyu patho ba ba gonafetleng le ba ba dikobo dimagetheng ba ba fe na mmadi a go mduela dipalanwa goba kwa mafeloo a go entiwa go nnaletlhotleletso mo gofe entin le tetlo la bobekien lefabolejalo mogaetso baita nape ba khalitsitse magetlewa le bantle goreng fa re batla gonnalithireletso e botoka sebaka se selen le kapan le kowidn rtswanetse rantiwa ka botlalo e di makgetlho a le mabidi ta montewa feda fenokikantlaya gore baikanape ba boletsirimtsetso e tsipang fa moente wa ntla wa faeda o nelana ka thireletsego mne ga witsi gore e nna nako ee kae mo lebiling ya ruonawe fela gaesepi thireletso e bonwang fa uintilwe makgetlho a le ma bi ini dipapisiso go twakwa nageya dukhin eli bontsitefa moentowa faesa o fukudutse seeno tsa ditlhwaitego ka diprsente masumatshupalebobidin marago ga o entiwagetnantlhan ne ka diprsentemasumamanye am ka tharelo dipene ad mathumarubonwet morago ga go entiwo lehetlola bobekin ne monogae setlamo sa diskabary half se sekafikile thidmsetlo ya babilisi ba ditsibiso tsa setlamo felo bale t million le ba hitlhete fa go entiwa ka botlalo  le makgetlo a lmabedi ka montle wa fenal o dira ga ta bontle that mogfireten kgatlanon lego mogela kwa bokilong le go tlokafanan wagaetso go botlhopa huitijana gore maitemamogoloapuson le go matlafata mafona a nnena batho ba lebantsi gore mebilia bonyeng e kgonye go lantsa korid n le gore ba fegapemmethapa fa bathwteriben kwatsa go tlhoka na kajalo go ya go entiwa lekgetlola bobedi go kanye tefata fa fenosiki la galan mne puso lebaagi batshwanetsi go dira sanammogong e di de putsotsanetegonyotefata fa mafelo a go entela baagi a fithra bonomolonl golrisatsirtsa fatlego otimonklemolomo kapa makogo ka metrihisetametane matlama bekin ata dirisa kebladkotise r nanyepaaging mne katoganye lebaotsa dudin mahabon ke lebaganatleto ya lonan disekagoleboga emon le nofela kaantlentlanorana na tholosentle le mo onakonyetlantla re tdirefera jalo"
