"episode_name","duration_seconds","transcription"
"Online vaccine certificate rollout, UK red list","465.73","e ketshedimosetso ya kowid n oitlisediwa ke mo tswedinya femo konkabokamooso kiaitsi gore ore boleletsi ka kgannye malobafa ya dijital yaksine sertifikate gore ya gompieno re katsena raipatlala diotsa ronaecc a ko mbolelelego go se neneka yona kanny le prebc enilentengeya e mwan jaakanserbua yana ka ha se lepapalapipikanale letmulepe epegelo ba buaka gore ke ofisial lonj ya dihtaobain kard keone bopakibakarata ya bopakiba go enta ya magarat tlha ya karibua mmeee ba simoletse dape jouk  ndapekhatla entatespongisemikomo mneba buaka yonye mme ba simoletse ba reblella gore e rehintsere bona ditlhetlo ba mogare wa kowid  dia po tlasi mne e go gwabonthe gore leroborobola leluo la boraro le hedile tota gon gontlenne ga re lebelete gore yone ka jeko a ka karata ee ya mo ente ya mafaratlatla e pibitlhiwa kimmuso o kaetsa yange gore tsa ka neke tlhalosa mogarabeke gore o dirisa o dirisa o o yakoo  wephaitenyapen o oeya o tlenya information ya gago ke gore  ibinamba nomoryago ya ibi e ina sefanye le gore e go na le moragogam rugerekiramo ento rekireilee morago ga re kiramo ento rekireilee  di efhenes le di reblelang go rere entile ne go na le truf opet daination kot go na le nomoro e uifilwen ka efhenes eringori o enkile mnekionen nomoro e othenouidrifene gee ee batho ba bantsi go na lenteke bona le momafarteten a bitapolofo batlho ba bantsibario naki ditery efhenes euti thimusemofominyakayanke tlo trae karata ya mafaratlhatlhayangmme gek goru oo lelete o etn rpne mme ke bona ba ka go  go thusang goru o tlwe ba tle go romella diefene teo gape mme nomoro eo ya faination kord kyone o tletsenyang moo  mafara kng a ebds e ko kran ditoiked sa gago ra bona gore gatiganyanong e sentse ensipila mme rekaidiri sa lefafhalabipikanelor rejo  le tona ya bone rejo khatlete gare blella mo motsong ona gore go nale dilopetekhtare ditlhokang gore redirise yene  wehaiti e y ya di distokad e hetse ehimoletse nne ke tla dirumella le mmakobedimne go ibufela gore ke enwehaiki eo e o wa kenamoyonegananogaipi gomnele gore raite gore gare kwa diseta moento ko nale gore owetaka okgonagwetan kgonagweta ka esemes kapaka watap kapakadilepeiale mme kanako ee kgipi go biui kapalefhaphalabitikan acsy lethalete gore retayan  ddithaokhad retha dirifi  mafarakatlha a inthanet me reiti gore diwebsite e tsotsotlhe peeta o go di ananale e lefaphalabipekanelo di diletamo ento ke mahala di bitswa gore ke sero rekad lega ofena daatha kapo ofena ertame kgao ditsenya moo e fonuyagago otlakira jepotsotlheto ditlhokang ka yone eo nne  go botlhopa gore lekanako e o re bone gorere dirisatone ditkakaje a ka gathe e monrukile dikgante edi monapimabano gore uke united kingdom efete i peretshete ya gore e tlotlo sa afrika bora mooe moo red li ke gore ka le ba kala gore nebare dithafoparona sentebile kodimo kapalema le pebinte neba dibua a nerfa lekola gore ba ma afrika borakapa batho ba ba nabaya uk ba ta mo afrika bora neba sa kgono go thena lelebane baepa karentin ef ya e lenyatsimmuso koo uke elen ya malatsi a le nasome me ge yone e ne e e ec ura thata e lee tpa pe rribua ka gore ke f t le ge ntse re bona  dirantadi le f t  le ge nente go bonwa gore kgo nalebate ba banti ba ba setse bakrelemo entom afrika borwa mme gahi tsebabule gore  oka rekadu gotogamo pekin telang oka ma afrika borwa akaya kapa batho ba batwang ba ya uke gotomo afrika borwa bakaya ko uke ba sa tleke go mna mo yona khwarenthini eo ya malatsi a le mahome mme o toduritha leyone dijital baksin khadi ena gore ga o pena enkoo the uke o ba bonti gore totapota ke bopakibagoba gore o entilwe gare lebelets ganano gare ka botagore ja ka nekibua emon moo mo emomalobeng gore go na le bakge topatota ba ba treilen yonne dttain khat ya bone gaen lefaphalabitikanalnethentle le bankanya websaite ya teng mme lefaphalabitikanale lekhalosa gore gore a ta nekibule gore nebafetsa ba ba ba tshunile websaite ya tsenkapa e ne e le life ka lebakala gore neba ba tlo bona gore ga ba ibula tsim okajet ebaraka sinkle ne ga gona  sehisabireken senkle mo yone websaiti eo me gape gao o tshwanale nna o ne o le motho o krilen wesate e u krillen dijithal khat ya ga gopelee websate ei dula senso o tlo o bona gore unalepo go kwadileng gore go nale epiridade ke gore poo e karata eka helang g e fela ka  ngaga wa ttt gaotimolola mme lefaphala bitekane letlhalosa gore ke gore nesentsebal leka lekanyeitsi mmutimmu omnek ko gore fela o ka ithutsa fela gore o etsa gape o ikwadisetse dijithalkat o krek  go nnegananong websit ie e bukehimmutso ne o tla kira didithalkhat yagago enhhinte e tanatsakajeko emalragana pontopelanretlananantsere tswalapelerego reditse letsatsiletsatsi ore arabela dipotso te r dibotsangfa nna le mafelwa bekeaman nate re tlaboisana gapelwna mobekeng e tlaehale lethaletsenkleliebe le mafela beka menati emon motsula lebabeta le bareti ba runa koo hae ere kakopana mobekenge tanki pontsopilane me ga digangwa tsapholarbamorenakon ka tsa kowid"
"Prof Shabir Madi we need to vaccinate 90 of over 35s","417.63","e kitshedimosetso ya kowid  noitlisediwake motswedinya femo kongkabokamooso oaepantswa emanlekae re tenlekae kipen emonttko re tsugilesentla rnamatsapa wa re barenka matikibok ma th napo aaarake kompiana re ka ua gore  retelefetse gore baba neng mo dijarantse epin go yako htif emon ke bon ba batle obonnang gore re ka bona ntpetelg lebelete go bnegbua len profesa shabirmadi yoo e leng tonaya thakautia mtekanelo haf snsisko detinisety ne raite horlene e nee le onaepeletepele  dipatihetadihinkauthale te ne i dibagalamoo afrika borwatanmo ento mmeek agago lebelefiana aba ba kotlake ga dijaratse setihad ke bone ba ba bonang gore ke bon baba ba ka bonang repena moyonayed uiti kapare bona gore re kgarka bontha gore re ente kapa afrika borwa e ne ba ba mo dika dingwagate e tedi ko dimagatedhak ehen  kotlati ko dimatedihat gare ka bona ba entilere ka bona gore  p ya bana gare ka ba entere ka bona gore ga n ngwagoo fela gare fenamo kresmetnya ngwaga o re ka bona kthotarnadiletotlahithata mme botlhokot gore re bone gore bone ke bone baba baba lenkodima petifati ba ba ntsi thatamo afrika boramni go bontlha gore ke bone babakakgona gore le bone dithatagotarina dietotlahithata mme soperebone le ditshatego di fa nna di dithata mme tlhofefa madi watlhalotsagape gore ratatatsaga go lebelletse ba etttha ke bona ba rernaganang gore  tatanta go bua gore ke bona ba banaganang gore bakaeta gore bith ba ka enta balebanpire ka bona eephetogo mo leroborobonle mme o tlholofaene ka buutanapebagage gore re tlhoka ba ba lemmo dikarentse mo dingwagentle tf thhikwi le go ya kooduno gonne rebone gore ke bona ba ba tlhopagalankhata ee ke bona ga gol lepeledipalopalo ka bathe ba ba tlokofalang ba ba gapelang ke boleti ke bone ba dingwagatoo toko te dihatlho ya kodino ba ba bontshangorethata ke bone karemommeleng ee ga ba thatlihile ka mogare o wa kohid  ke bona ba ba tlokolang papaba ba gatelang ba lwala mmegape ba tlha kofala ka malepi a a manang leyone kohid ne ga mtertsa mayana e mondraita gape gore bathuta ba bota batlho ba ba botsa gore ana re tleipona mo atletha bora go na letleribita gore ke gore re entla batlho e munnle n o thwanete a entiwa ana le faphala bitekanelo kapalu e puto e tloo bontha gore ka pa petafo moo ko go diriwang a ana re koo bona gore batho bakoo pa peleta gore ba kronu entomme ka ka ke na ya bitekanelo auile mo bekin e fitilenge naka jopata o tlhalisitse gore go ya koo go pateletsa matugoya moento gago batugori riyepo gaheheresibatlang  gahihepisesi batlansone go batla puso e batla gore go tlhalisetse batho  moento o bere kayan tintla gore ba kono go u batla bone ehngore o apapeletsammobatlong mmen ga re lebeletsikanako e le ga re kapateletsa o ka fagapife ka pateletsa batlo mo ento go tlhadua gore go na lidi go tlway re ka bona gore athe batlahitshepipiso bya ka nintebaithepapele le go re gape bothata ba gore batho ba sa enta engono ase gore bathogababatlimo ento k k r bathogabatlhalogany me pele re batlho papeletsa ba tlhogorba kremo ento baisana pe batlhalotsa gore goka nna bo tokwa gore lhalose re tlhalose batho nee goremo entle oo o berekayang epelegape rebareba papeleta ona gomne ogokafi nne monatarkapapeleta thofetsha mmaadi haternit gore gape go na lidipolelo ka gore gota kommofeja gore gekotlhopiwadi ntado tsafaesa kapa ka jonsonn jonson  ne arekanako e kgatse hoo re le bellepinpeng pe ne re batla go bontha go enta bathababansi e lerenaganale gore go ma le babanbabahannego krame ento o monga mme dipatiso tsa gore ana re totlhoka goo eta dipustashat go lebeletse lehapola dipekanale le ministerial a badl komiti ya kohid  gore banaagane a ka baatlhatlha dipatisiso te ditankomasathi a mangwe sa gore  go e ana reka rekatlhopa goeta diputashot mme le baitanapagaisi bautuanisike kapasenta ba baa ba ba ba bua mo gara bona gore ana dibuktashot e e re paetlhopan gore a na adiriba bitekanalwe le bath ba bamba ba tirieleg moento wa jonson n jonson ak baka kgona go krea putashot o mo ento wa wa pusta o elin oo o tsangpo faida ne ka nako egaithugopeiditshweetso kapadithwaithugobeuli dithulaganyemmo teleng eg mne tehantlha tse afrikhabora lepuso e batlo se bonanki gore re ente batho ba bantsi mongwe lemongwe o lenko  dijar mmo di ngwagentle etsigoya kodim ke bona ba rebatlang hereba kiremo entopeli ke gwana rekabonarebuakathedugapej haphaladipikanelo likhalehietitanetatajeke eman ralebogaponsopilane ka tsherimosetsa gompiinetlhe o tlhoresentleretlabisanagapelwena ka mosoiakagale khelahinke eman lebaretibakhalehentetgemme ponsopilane me ga digangwa tsa phaolo"
"A go gotlhola ga gago o katswa go amana le COVID19 go ya ka dipatlisiso tsa ko S","423.25","e ketshedimosetso ya kowid  naoitlisediwa ke motswedinya femo konkabokamooso soyadankira leboga ee awa go tlolaponsokgakigotlho le nnokifian hela gaifi kethara leke khohidi eekapa ke nalebathrba bana le mog ngnbthgonale go nale ke go botsa ka go gotlhola yaanaka gore kwa yunibesiting ya kwastarlan bosh kwa kape tawn aba buakgannya gore go nale ka mokgoka kgonan gobonaka teng gore segotlholose ke sa kohid  a kompolelle gore ga temfankhn iipedintlhated tjulen poo salenatnbes te baitsana pe balenne ba lebellete gore go birita aeriditankeone bo athitijao inteligens tekhnolojy nesin lenen e go bua gore mogwakgelo wa koketmanpin ko o yang nne mogwakgelo ee ne mogwakgelofela o meng o yangne baitsana pebaba ltse go bontlha gore baleba ba dirisa tekhnoloji e go bona gore ke mogotlelo ofin o kare motho o nale o tshaepegila ka kohid  ne ke ofen o renga a tshaepegaka kohid  nme ka nako e setlegolebellepi  dipatitsi ked tsamo afethaberwa leko di nage di modikontinenting ee ratar ne gare lebeleke e bitwan bya mo afrika e ditsa stakhob yonatakhob e ka bokhutanyana e dita ke sar kobedn unpat afrika e ikwellang mo e mokgwa om mogatlelo o biragalankaone itaia batho ba ba ne ba le moyonek me thothali e  baukalla goremo ba barekhoda e kgapita ba gotlola nne ba diritsa difoung tsa bonene ga ba feta ka dinakopedini morag peli le morago gabatlhatgilatsa kohid  nne  dikgatisa tsai dipenyamoyana tekhnoloji eo go bonta go re te kinif ifipahipa ya megotlholo itanayang eitanape batlhalosa gore e ga ba tekrile bikgapisote tsa batho ba gotlhola ba dipaya e ba ntlhapo batho ba didinepenpeng ba di kopanthafela mmogotlelo otle o gore ba bona gore e yone tekhnoloji e ya bona e kghon tagore mogotlholoke yan mne moragogateo pa morago ga dikgatisitetseo bataya n khatiwa mokgotlheleyoyotle eya a nalaidiwa go bona gor ge diragalang go bontsha gore e moitanape o mongwa bona we lentoktha phaha o bontlha gore are eri diikgatihisotennidiabontsa gore mogotlholo wa kohid  o twp shotha k gore o mokhutswan ka t nangare lebellese motho o hnang  mogare wa kowid  ke ka lebakala gore e manga ra ka gopolale gore babatihihi tlapabaitanapent bare tlh anka mogare o wa kohid  mogare akire o o nna momalatleng nne go ra go r gaona o mmo wa kapa o fidini eng ke gore o ko no gotlola hebaka ya ka o ka gotlhola ga o hina  mogare wa kohid  nne gwa bontla gore ga o thaitihileka kohid gokholo wago o ka sine motelele ya ka wa motlho o sa thaefagangee yone e baiditsa khop o dio klasifikation e diritiwang a ka re buaka gore ke tekhnoloji e birita nnee ee baitanapeba bona gore e ka dirisiwa gore e te kosid skrienin mo dikhwedintela tla lantle tya ka re bonagore renterele moleroborobolle yanaee beitana pe ba ba banne baba kwehelandas einehibare tentse ba le eba ba batlo a ga safhone ap makphone ap e e ka bathutangore iemne nyone yone e ba ibitankghebe klasipaya e ke gore e tla nna ap daaka ep enyelen yak efanalewatapele kwedintere dipurisang mo difounitarona o kgo nnogotlhola mmen baba tlo bona gore ana e ka thutha gore e di lella mothogore ana mogotlolo ananlone ke wa khositikapake mogotlholfela wa boletibobunge mme garebua gapeli peitsanape ba bana gore ana kobira ba tlo bona lleng  epoyo etagai bare geitibaebone ne tentle go l kgakanya kgakalanyana gore re bone epe e e mneteng mme gape e biritie ke batho go bona gore ana mogotlholekowa krobid mantin kapagatwaone tanako e go tlhokega gore batitito dioketie diitie ke ba tshobabandiphatae go tlhotaga didikghapiso te niti go tswa moma afrika borwa ba ba tshwatigilele ba ba tsa tswatigang gonne ee o ka kgona go bona ga o ba tla go kanelayone dipatisitote o ka yako koftat dot onlineke o tiu j t i lti tot online mme o ka nna  phatisipandetapa oka oka tsa nnaya dipatisitotse o tlhutsa baisanapep ba gore bakgone bona gore mogokgelo wa khosek masn o berakayang mmen ba bial gore sente gota he baka gore  ba kradkhatititeteo  ka napo e fentsebatsa phailat ya bone hentse baba tle bona gore ana e ka nnabathuabanti ba ba katenelanyene e a kaga re ka gopola e mnto gaheri baitsane ke btho ba tlhoka runa batho khela bamo afrika burafela ynab areti go re bathupe gore babane dipatisithepe tshapathatakabintsi ga o ikwaditsetsa dipatisitsetse tlhanaleano ga go na madi auakranye u thuta baipanape me bena mo ahethaborago re ko no bona  didipatisithepe bitlha ka bolete bo bontlha bobonn kohid go o ya koyona kobot  ko pe bat online o tla bona gonale e go blela gore ke iny  sese kiragalang gonne gorebatse birsa dikgatitisata go kweta ing kapauanluanlwan mme go botlhoka gore le rona re rokwetlen epanapebarona ke bathu ore ka bathwisanteng gore re bene gore ba bone  difolusin te dintlha go bontlha  e go gofelepa kapagepa kofid skrinin e nne bol bonolo e ka kamokgoo efinbonolo kanako e yan ke tswanepakajeto emanya gotogala ralebogatlhee wnapoedipediatlayan taeikoideretse eretshweerenaeeereraen e monaharepeyago ki porelepee tswantsoyanongo nnele ep go bona ore hotee eptare bonepeong kobit ke ao bathumpontsoyano re tshwere kohedye le ga le go tsiamera lebogapontre le tna kwagago  le ka mosotlhedirefela ialo"
"Bana ba ba nang le mathata a pelo ga mmogo le Pulmonary conditions","513.32","e ketshedimosetso ya kofid  nauitlisediwa ke motswedinya femo konkabokamooso soomabaneribuaka ka ka gongwe banaba ba iponnansetlhadisiwanjaaka inflamation fa lafamorao ga moentojaano bana ba ba na nlee ke a dime gape leroole la khadiek le palmonary konditions boona rarenka bona fa ratamo monto eman gatibotpa beitanakwe ba ntlhalotsetsa gore kanako e haitigekidipatlisito mo banenbao mnen ji ta ganaribua ka maleti a mangwe munni empeng bo toka oo ya omakeng yagabo kapam penape o mmonanka le bakalatapholo kapabulet boophilankabone o duelene o mmete gonne bonebakaidi gophala  bathbabanti gonne a fe ko re dipatlititetotetle jipebedipi mme gape le gore ga go hnya dipatli ediediten gapore gore gapele gore go na le bothata dibepedintfe ki gore beipanape gaisibadit e fe gaisidikholin  nne geifi dilebele gore go bonywa dibaraka ya nkapa mo mmemengwa batho me kanako e a ka nekitlhalotanabane gore dihat infenenpe bja diragala mne  kgapegabaria gore bo mael m  informetiono ya myokhaydayt ke kaitherebolalone mnen e banthalekore apele e ne n e na leyone entlenisin e ikga rintla ikare ke beitana fe batlhaoka gore ga rinjya ekaekare e e re e ritshopa na gana enflanatinketeheh hehe he hekenathatannen e beitanahe batlhauta gore batlho ba baenti ba batharantemaeo kaeka bahoola le gatiba tri tritmende kapa go fi nagorepiru ihinyehile ka rolopapele dihinyehile thata mne tepateta ja ka bolefi bobong ye bobong emone go na lefo goreng inflanation e eka nna ya gapelela mme ga go tsa ga mota akatitrithuso thapapholo ekene e ka gapelamomelen baitana ka batlhalepalot bore ee re go polya gore pille ke mo tsupa o motona thapamomilengwarona mme ga mapala a mme ya rona a ya  ga ga ga go katsena mogare mo pelong ya rona re go polo gore mafela a mme le a rona a tloba tla gore a ntlhe mogare oo moo pilo kgo nnera tloganya korepilo ya re thutsamk gola a mmele a lwantlha mogare mopelong hot go bona gore lekore mo go bona gore be ka bona gore lee dikarolopa pen ke mne nhunkete di tshusangpelo le mme larona dika tsona le pona dikasnyege go tshonatlala a tlagaonadi antibiotik ka bn o na le insfektion ebe e ngaka e go fa di antibiotik diantibiotik bja gadin thefela insfektion i e dintlhagape le  baktiria ee mpinpintlamonele e re tlhutsang gore re kgonog ila go nale e jone bakteria kapadjan tse da ja napeldinapat baretlhalspa gore dihiare ne ka kayonen le bakaleore ka bonale gore maethadthti e e kgatelle ka bunikitopa baisana ka batlhalesa gore ahe kann kan ka nna ntire ka bona gore  batho baka gona po kriar bana ba pa krayone inflamation eu mme gwathata gore lebakala gore ngwana kapa go bona gore ngwana o mokotsin ya go kira infomation kga po ko trano ento o le nwa hba e ko tlahi tlahi tlahhi tlahi ke kale ba kaleld afrika bora e tlhalifa gore ba tserefhepe ya go fa bala mo enpe o le mele yone e ya ihleneti e bonnaphata tgebana ba krelen empek e le le peb enon kitshofo ditlhokatse  batshadi kogae khe ne batlhalgadi mmon enpo o lemong kusiami mme ke me enpo e me bedi e ne go bonokore keomme ekareng e nepa yene information e ne boifanake ke gona yango batlhalota gore ka leba kale e ba reki id ektrim lere gapenikidwa lebono gore e goka nna le inflematin moo leng e lemao le lelengwela faeda nneng  dintlamrago te di kabonang ke bana ga batlano nto o lemon o ke ped nletsabathobalki ya lo gore ko botlhoku faotladilenpeng le dilepo yalo ke re ditlwate mme wa bontha gore le ge bi ditlamera go di biragala mo motho o la mmung e noo thentse ya batho ga re le beiletdtlanara one ke ditshanalebomaokaedet kapapedigapelepek di bontha gore bidira galamo mothun o le mungwi mo ba thombale wsd ba ba kranme ento motho o munli ou o a le mungwi mo ba thombale ws keenne baitsana pe ba bonan kapadipatiswad bontsam ore ke gono ba ka bona gore  babo ba ka bona gore batho ba kirean ditlamorago ten harkaedwa ka dikahenper wa ka ero pai ero w pent ya batho ba ba ka kireang ntlamorago kete thanale bo hati mnetlhwe ke go re gasehetes ka diragalang  ponolo ke mne gapegase biragale tga go pilwe panamo enpe o le monyyi wa faeda ja kare ronarefa paba aflikabora e bineleji h rekup kotie moente olemenme beitanape go teleleta e ngwang batlhafale gore en ya ne hapihenisin e e kabony aekatlhaga ge batba bona gore ba fo enpiwa kapa ga o lomillete ngwanaga e e gore a moragotefeng ka dibonang  tnnomolelela gore ana mmote gore ana o na lee malhatlhagaga a botlhoku o na le dipeng le popelong kapadilepeyalo a o na le bothatsa bagore  ga rewahena ka rwainelwa kapa o na lenfikela gape  ga ntsantefo mne e ka bolipiraifigore bana fe ko nkgabese gore ba rera tadiyak bat baitana ke batlhaletha gore ke gore o mne ekeletlhopo gao bona ngwana e kare ko lapile kapa o gai gaitshware jaaka ukwaete gore na ngwanaka o yana o mafolopolo phakela o mafolopolo a o mmona an na mo ditebong a sa tumoditibong arefela segero o ka lebelela khrundtente me gape gaonanongwano o thamkambedi spot pespolon e a sa tshameka thata yalo nata a le matlhango morago gatra moento ke kao ediete batswadi ba ka ditang gore ba hirenlepe bana ba bona gore bitla morago wa moento dita bagapela ga bakirile moenta ke tpanatakakkimanso autageralebogatlhe rukwile re tlhalogantse re tla le bogela moretsi ka karaboyore netse nyonatlheretledirajialo gore re tswolepeleka dipotsotsa dibotsang re go rumele tsona o re tlele dikarabotseoralebogapontsopelentlholesentetlhenkwaleboga emo nnotlela lemakobedidithalopantle libaretskgad"
"Kgatelelo ya maikutlo, ketsaetsego le moento","452.64","e ketshedimosetso ya kofid  naoitlisediwake motswedinya femo ko nkabokamoosoomadumeleko koladirage ne ke ko paore le mpoletse mme o wa tsapholo oo tsenamphakela o lebetsi dinalagage le mpoletseng mo gwene gore amotho o na le e nsaiati ausiano gore aka goo waksina nakhoisnekerejisti ke palwale ke go yakiatshaba kabaakala go rakitse rsetsinjwerese a ga se na bothatalehankatlhabakopa gore le mpoletse ngenetswetswe kya lekopabagaejeem ooan ga dimosela le mmakobedi ka leratabagaeje paeewitlhaloganse ketlhalogantse engwan ketlhalogantse popo ya moreti mnee egke poto e htika to eka legilemekepopo e bo e bo tlhokwa e go nne go nala batho ba banti ba ba nnang ka kgatelela ya maikukowela reuaakayanedipresin kapardiaka endaeky nne ga rel lebella gorebaitaanapebarenka batho ba ba helanka balete a maikuko kapa atlhaloganyo eni entoga o bonte go na lee  tinisemo entesekauetang nne mokwa o mikod maiputla a ga go tapatlhaloganyo ya ga go eberkankatseng mme gego sinedipatlisise moo dibekeng tsehipileng tesedi bontan gore bati ba ba phelanka kgatelelo ya tlo penta gwa batuta gore ba fa nna ba lestrah kapaba theniilekhata mo maiputlong nne dipatlisotee e mondi ddi die dipeko the united states gwa leballa gore  kgatelelo ya maikutlo kapabipekanelo bapatu ba maikutlo lec loganyo ka lebakala go entago tsa mayan le e beipanapebalebelets batheba le e go bona gore go diragalang kapa mei trata bone leyone yone enjaet ya bone e ako dimo kapa e akotlafi morago ga ba enta a gore raiti tatatapaseta go bono gore  le dipatihtoten tja mo afrika bora dia bonta gore batho ba banti ba na lekgatalelo ya maikutlo lee malete a manti a tlaloganyo a tlile ka lebakala go rrephila moo lera borobolgole le la kob  me ntsa gore  go bontsa gore ga batsho ba kiramo ento maikutlwo a bone go klhenygaka gore baka tlhakofala e le le bata la kowid  go ya kotlatinn dipatlisisotse pee di tileng mokgwebing epipileng dibonsi tse baitana pe ba lebella kgatelela ya med tlo ditsekanelo batlhaloganyo ba batho go bona gore anna topatopa kga ba entile  ba ba yako  gatgele batshenyega ya pa ne bathenyegapele mme go a bontsha gore ga ntse baitanape ba bota batho ba le ets bao gore  ba ikutlwa yanga aikuka enjaepidi kretian ledistrat kabone ye le koodimo ee moragoga ba ba bota difoto go bogo a tlhatlha gore ensaepiditretiliionetrate se tsa mapoka moragoga ba kramu ento ba ba buditsepiliba kramu ento le moragogaba pe tutrea ne go a bontlha gore atota dilope tharupe dia kotlati kgetelelo ya maikutlo gothonygaka gore anna ditlatlhakopala diklotshatega bape ba ke baraatan ntalatsata badirakame baagisanibame kayone kohid e ne mogare wa kohid  ae ka diraga emme maikutlo ao a yapotlate go nnebaketetse batlhaloganya gore gao o enta o waikireleta mme okireleta lebao o bao baratang me goa bontlha gore batsho ba banti ke ebitekanelo batlhaloganyo le kgatelelo ya maikutla bone e nna bepere kapae nni e nna e nna bonolo moragogapa kramo ente ne boitana pebarre batho ba bantsi lege baabai ba ba sabakon go entiwa senteba sentse ba na lidithyo mathenyga a mantsi gonne batsha ba gore mo ente o ka baefa ndiloteyalorayt gor gonalebatbabantli bhba ba tshabalemao kapababatshabaya ba ba tshabangothabiwa kapaba ba tlhaban gore ba tlonyega gore go na le sensase ka diragala mmo bone mora go gaba kramo ando le bonne maikgatalelo ya maikukwa bone e hente e le kodimonyana ne gwa bontha tatatapadipattota gore mothogai bona gore kha tlaloganya gore a ka selwale ka lebaakala mo ento kapa d  go entliwa mekuka a gage a babepere ga gona fefe bontan gore gonale kama go na le mkgwa o mo ento o ka fetolang n mmel wa gago le maikutla wa gago nmege ba ko national ha sarie ba ko uk ba ntten e pegelo ba tlalosa gore go na le batshu ba ban ba babi banaletebi menta elnet mme ga baetlhalofa ba enet etbako united kingdom gore tebia mental elnet ke go ra gore ba re ke batho ba ba phelankam malwepe a tlhaloganye a tshana lehtipoprinia baepola kapamalete a tlaloganye a etan gore e baibikaaka shwariditab tebiat fanktional enpement ke gore ophela ka bolwetse o na le bolwetse batlhaloganye boboo bo bogo amang thatsa gore o pallwa le kogotsa diloto die tsang ka lesatsile letatsi mne go a bontla gore  publik health england kapabaitanape le putlo ya ingland leyone e baibitang  bbi ke gore ki binak yonan ministerial adbiser kommiky e tshwanalea ruma mare yaako united kingdom e bonelegore kut iame kapabati ba ba thelan gamaleta twana le bokitohinia le bobephola ba buzue le dinyaka tla bone eepele ak kramo enta ga bana le maphenyego ka gore anamo ento o o ka ba ana ka mokgomong mme kanako ya gore ko inlandeganano ko inland ganane setsebatumoluto le go kradibuta jot babua tatatataka gore go kanna le khetogo gomme ke tafod mme ga o kirahelanb lemaola le le ngwe la johnson kapa le a mabedi a sese gago bonte gore ee naikutlwa a gago le bitekanalebathaloganibaga go bahetoga ke moento ke tonetsaka jeko emonposo ralebogatlhe ka tsapa ya goretlha moreti gutule sentle e biler tlatswalapelefala ialo re baruta re bathusa ka dikarabotsee tsa dipotso tje bonaletsonaralebogautwa ponsotlho lesentletlalasentle emon mtela lemakobedi le baretkoga"
